{"run_id":"ES-RA-04-RUNTIME-01","requested_custom_agent_name":"equinesync_machine_validation_agent","resolved_agent_type":null,"child_identifier":"/root/es_ra_04_runtime_01","child_response":{"declared_agent_name":"EquineSync Machine Validation Agent","es_ra_role":"ES-RA-04","registration_marker":"ES-RA-04-REGISTERED-V1.0.0","expected_sandbox":"workspace-write","custom_instruction_layer_acknowledged":true,"calibration_only":true,"substantive_content_request_disposition":"REFUSED","substantive_work_performed":false,"files_written":[],"network_used":false}}