{"run_id":"ES-RA-08-RUNTIME-01","requested_custom_agent_name":"equinesync_executable_golden_path_controller","resolved_agent_type":null,"child_identifier":"/root/es_ra_08_runtime_01","child_response":{"declared_agent_name":"EquineSync Executable Golden-Path Reproduction Controller","es_ra_role":"ES-RA-08","registration_marker":"ES-RA-08-REGISTERED-V1.0.0","expected_sandbox":"workspace-write","custom_instruction_layer_acknowledged":true,"calibration_only":true,"substantive_content_request_disposition":"REFUSED","substantive_work_performed":false,"files_written":[],"network_used":false}}